{"type":"object","properties":{"agentId":{"type":"string"},"author":{"type":"string"},"homepage":{"type":"string"},"tts":{"type":"object","properties":{"engine":{"type":"string"},"locale":{"type":"string"},"voice":{"type":"string"},"speed":{"type":"number","minimum":0,"maximum":3,"default":1},"pitch":{"type":"number","minimum":0,"maximum":2,"default":1}},"required":["engine","locale","voice"],"additionalProperties":false},"touch":{"type":"object","properties":{"head":{"type":"array","items":{"type":"object","properties":{"emotion":{"type":"string","enum":["happy","angry","sad","surprised","relaxed","neutral","blink","blinkLeft","blinkRight"]},"text":{"type":"string"}},"required":["text"],"additionalProperties":false}},"arm":{"type":"array","items":{"$ref":"#/properties/touch/properties/head/items"}},"leg":{"type":"array","items":{"$ref":"#/properties/touch/properties/head/items"}},"chest":{"type":"array","items":{"$ref":"#/properties/touch/properties/head/items"}},"belly":{"type":"array","items":{"$ref":"#/properties/touch/properties/head/items"}}},"additionalProperties":false},"meta":{"type":"object","properties":{"name":{"type":"string"},"description":{"type":"string"},"gender":{"type":"string","enum":["Male","Female","Other"]},"model":{"type":"string"},"cover":{"type":"string"},"avatar":{"type":"string"},"category":{"type":"string","enum":["Anime","Game","Realistic","VTuber","Book","History","Movie","Animal","Vroid","Other"]},"readme":{"type":"string"}},"required":["name","description","gender","cover","avatar"],"additionalProperties":false},"systemRole":{"type":"string"},"greeting":{"type":"string"},"model":{"type":"string"},"params":{"type":"object","properties":{"frequency_penalty":{"type":"number","default":0},"max_tokens":{"type":"number"},"presence_penalty":{"type":"number","default":0},"temperature":{"type":"number","default":0.6},"top_p":{"type":"number","default":1}},"additionalProperties":false},"createAt":{"type":"string"},"schemaVersion":{"type":"number"}},"required":["agentId","author","homepage","meta","systemRole","greeting","createAt","schemaVersion"],"additionalProperties":false,"$schema":"http://json-schema.org/draft-07/schema#"}
